{
  "system_id": "EXAMPLE-ELIGIBILITY",
  "context": "Hypothetical system ranking applicants for a social benefit (not a BAPIL system)",
  "prohibited": {
    "social_scoring": false,
    "mass_biometric_surveillance": false,
    "opinion_profiling": false,
    "deceptive_synthetic_media": false,
    "manipulation_of_vulnerabilities": false
  },
  "scores": {
    "D1": 3,
    "D2": 3,
    "D3": 3,
    "D4": 2,
    "D5": 2,
    "D6": 3,
    "D7": 3
  },
  "rationale": {
    "D1": "Decisions about specific people"
  }
}