{
  "system_id": "BAPIL-P3",
  "context": "Aggregate analysis of consented, de-identified consultation submissions",
  "prohibited": {
    "social_scoring": false,
    "mass_biometric_surveillance": false,
    "opinion_profiling": false,
    "deceptive_synthetic_media": false,
    "manipulation_of_vulnerabilities": false
  },
  "scores": {
    "D1": 2,
    "D2": 2,
    "D3": 1,
    "D4": 1,
    "D5": 2,
    "D6": 1,
    "D7": 1
  },
  "rationale": {
    "D2": "De-identified personal data",
    "D3": "Fewer than 10,000 submissions"
  }
}